{
  "n_extra": 48,
  "n_missing": 0,
  "rows": [
    {
      "actionability_family": false,
      "case_id": "p3s-suf-d1",
      "distance": 1,
      "edge_set_exact": false,
      "extra_edges": [
        [
          0,
          1
        ]
      ],
      "fail_closed": false,
      "false_reference_edges": 1,
      "family": "suffix_collision_only",
      "format": "key_value",
      "gate_expected": false,
      "gate_observed": false,
      "gate_ok": true,
      "intended_mean": 0.0,
      "intended_reference_edges": [],
      "mean_reference_edge_distance": 1.0,
      "missing_edges": [],
      "n_reference_edges": 1.0,
      "observed_edges": [
        [
          0,
          1
        ]
      ],
      "ok": false,
      "policy_seq_ok": true,
      "policy_sequence": [],
      "policy_sequence_expected": [],
      "raw_edge_rows": [
        {
          "atom": "keg_p3s_suf_d1",
          "distance": 1,
          "dst": 1,
          "src": 0
        }
      ],
      "surface_id": "p3s-suf-d1-key_value"
    },
    {
      "actionability_family": false,
      "case_id": "p3s-suf-d1",
      "distance": 1,
      "edge_set_exact": false,
      "extra_edges": [
        [
          0,
          1
        ]
      ],
      "fail_closed": false,
      "false_reference_edges": 1,
      "family": "suffix_collision_only",
      "format": "compact_json",
      "gate_expected": false,
      "gate_observed": false,
      "gate_ok": true,
      "intended_mean": 0.0,
      "intended_reference_edges": [],
      "mean_reference_edge_distance": 1.0,
      "missing_edges": [],
      "n_reference_edges": 1.0,
      "observed_edges": [
        [
          0,
          1
        ]
      ],
      "ok": false,
      "policy_seq_ok": true,
      "policy_sequence": [],
      "policy_sequence_expected": [],
      "raw_edge_rows": [
        {
          "atom": "keg_p3s_suf_d1",
          "distance": 1,
          "dst": 1,
          "src": 0
        }
      ],
      "surface_id": "p3s-suf-d1-compact_json"
    },
    {
      "actionability_family": false,
      "case_id": "p3s-suf-d1",
      "distance": 1,
      "edge_set_exact": false,
      "extra_edges": [
        [
          0,
          1
        ]
      ],
      "fail_closed": false,
      "false_reference_edges": 1,
      "family": "suffix_collision_only",
      "format": "pretty_json",
      "gate_expected": false,
      "gate_observed": false,
      "gate_ok": true,
      "intended_mean": 0.0,
      "intended_reference_edges": [],
      "mean_reference_edge_distance": 1.0,
      "missing_edges": [],
      "n_reference_edges": 1.0,
      "observed_edges": [
        [
          0,
          1
        ]
      ],
      "ok": false,
      "policy_seq_ok": true,
      "policy_sequence": [],
      "policy_sequence_expected": [],
      "raw_edge_rows": [
        {
          "atom": "keg_p3s_suf_d1",
          "distance": 1,
          "dst": 1,
          "src": 0
        }
      ],
      "surface_id": "p3s-suf-d1-pretty_json"
    },
    {
      "actionability_family": false,
      "case_id": "p3s-suf-d1",
      "distance": 1,
      "edge_set_exact": false,
      "extra_edges": [
        [
          0,
          1
        ]
      ],
      "fail_closed": false,
      "false_reference_edges": 1,
      "family": "suffix_collision_only",
      "format": "reversed_order_json",
      "gate_expected": false,
      "gate_observed": false,
      "gate_ok": true,
      "intended_mean": 0.0,
      "intended_reference_edges": [],
      "mean_reference_edge_distance": 1.0,
      "missing_edges": [],
      "n_reference_edges": 1.0,
      "observed_edges": [
        [
          0,
          1
        ]
      ],
      "ok": false,
      "policy_seq_ok": true,
      "policy_sequence": [],
      "policy_sequence_expected": [],
      "raw_edge_rows": [
        {
          "atom": "keg_p3s_suf_d1",
          "distance": 1,
          "dst": 1,
          "src": 0
        }
      ],
      "surface_id": "p3s-suf-d1-reversed_order_json"
    },
    {
      "actionability_family": false,
      "case_id": "p3s-suf-d3",
      "distance": 3,
      "edge_set_exact": false,
      "extra_edges": [
        [
          0,
          3
        ]
      ],
      "fail_closed": false,
      "false_reference_edges": 1,
      "family": "suffix_collision_only",
      "format": "key_value",
      "gate_expected": false,
      "gate_observed": false,
      "gate_ok": true,
      "intended_mean": 0.0,
      "intended_reference_edges": [],
      "mean_reference_edge_distance": 3.0,
      "missing_edges": [],
      "n_reference_edges": 1.0,
      "observed_edges": [
        [
          0,
          3
        ]
      ],
      "ok": false,
      "policy_seq_ok": true,
      "policy_sequence": [],
      "policy_sequence_expected": [],
      "raw_edge_rows": [
        {
          "atom": "keg_p3s_suf_d3",
          "distance": 3,
          "dst": 3,
          "src": 0
        }
      ],
      "surface_id": "p3s-suf-d3-key_value"
    },
    {
      "actionability_family": false,
      "case_id": "p3s-suf-d3",
      "distance": 3,
      "edge_set_exact": false,
      "extra_edges": [
        [
          0,
          3
        ]
      ],
      "fail_closed": false,
      "false_reference_edges": 1,
      "family": "suffix_collision_only",
      "format": "compact_json",
      "gate_expected": false,
      "gate_observed": false,
      "gate_ok": true,
      "intended_mean": 0.0,
      "intended_reference_edges": [],
      "mean_reference_edge_distance": 3.0,
      "missing_edges": [],
      "n_reference_edges": 1.0,
      "observed_edges": [
        [
          0,
          3
        ]
      ],
      "ok": false,
      "policy_seq_ok": true,
      "policy_sequence": [],
      "policy_sequence_expected": [],
      "raw_edge_rows": [
        {
          "atom": "keg_p3s_suf_d3",
          "distance": 3,
          "dst": 3,
          "src": 0
        }
      ],
      "surface_id": "p3s-suf-d3-compact_json"
    },
    {
      "actionability_family": false,
      "case_id": "p3s-suf-d3",
      "distance": 3,
      "edge_set_exact": false,
      "extra_edges": [
        [
          0,
          3
        ]
      ],
      "fail_closed": false,
      "false_reference_edges": 1,
      "family": "suffix_collision_only",
      "format": "pretty_json",
      "gate_expected": false,
      "gate_observed": false,
      "gate_ok": true,
      "intended_mean": 0.0,
      "intended_reference_edges": [],
      "mean_reference_edge_distance": 3.0,
      "missing_edges": [],
      "n_reference_edges": 1.0,
      "observed_edges": [
        [
          0,
          3
        ]
      ],
      "ok": false,
      "policy_seq_ok": true,
      "policy_sequence": [],
      "policy_sequence_expected": [],
      "raw_edge_rows": [
        {
          "atom": "keg_p3s_suf_d3",
          "distance": 3,
          "dst": 3,
          "src": 0
        }
      ],
      "surface_id": "p3s-suf-d3-pretty_json"
    },
    {
      "actionability_family": false,
      "case_id": "p3s-suf-d3",
      "distance": 3,
      "edge_set_exact": false,
      "extra_edges": [
        [
          0,
          3
        ]
      ],
      "fail_closed": false,
      "false_reference_edges": 1,
      "family": "suffix_collision_only",
      "format": "reversed_order_json",
      "gate_expected": false,
      "gate_observed": false,
      "gate_ok": true,
      "intended_mean": 0.0,
      "intended_reference_edges": [],
      "mean_reference_edge_distance": 3.0,
      "missing_edges": [],
      "n_reference_edges": 1.0,
      "observed_edges": [
        [
          0,
          3
        ]
      ],
      "ok": false,
      "policy_seq_ok": true,
      "policy_sequence": [],
      "policy_sequence_expected": [],
      "raw_edge_rows": [
        {
          "atom": "keg_p3s_suf_d3",
          "distance": 3,
          "dst": 3,
          "src": 0
        }
      ],
      "surface_id": "p3s-suf-d3-reversed_order_json"
    },
    {
      "actionability_family": false,
      "case_id": "p3s-suf-d4",
      "distance": 4,
      "edge_set_exact": false,
      "extra_edges": [
        [
          0,
          4
        ]
      ],
      "fail_closed": false,
      "false_reference_edges": 1,
      "family": "suffix_collision_only",
      "format": "key_value",
      "gate_expected": false,
      "gate_observed": true,
      "gate_ok": false,
      "intended_mean": 0.0,
      "intended_reference_edges": [],
      "mean_reference_edge_distance": 4.0,
      "missing_edges": [],
      "n_reference_edges": 1.0,
      "observed_edges": [
        [
          0,
          4
        ]
      ],
      "ok": false,
      "policy_seq_ok": true,
      "policy_sequence": [],
      "policy_sequence_expected": [],
      "raw_edge_rows": [
        {
          "atom": "keg_p3s_suf_d4",
          "distance": 4,
          "dst": 4,
          "src": 0
        }
      ],
      "surface_id": "p3s-suf-d4-key_value"
    },
    {
      "actionability_family": false,
      "case_id": "p3s-suf-d4",
      "distance": 4,
      "edge_set_exact": false,
      "extra_edges": [
        [
          0,
          4
        ]
      ],
      "fail_closed": false,
      "false_reference_edges": 1,
      "family": "suffix_collision_only",
      "format": "compact_json",
      "gate_expected": false,
      "gate_observed": true,
      "gate_ok": false,
      "intended_mean": 0.0,
      "intended_reference_edges": [],
      "mean_reference_edge_distance": 4.0,
      "missing_edges": [],
      "n_reference_edges": 1.0,
      "observed_edges": [
        [
          0,
          4
        ]
      ],
      "ok": false,
      "policy_seq_ok": true,
      "policy_sequence": [],
      "policy_sequence_expected": [],
      "raw_edge_rows": [
        {
          "atom": "keg_p3s_suf_d4",
          "distance": 4,
          "dst": 4,
          "src": 0
        }
      ],
      "surface_id": "p3s-suf-d4-compact_json"
    },
    {